{
  "equipped_moves": [
    "miduo_blue_idle",
    "miduo_blue_walk",
    "miduo_blue_run",
    "miduo_blue_dash",
    "miduo_blue_jump",
    "miduo_blue_big_jump",
    "miduo_blue_knockdown",
    "miduo_blue_fight_idle",
    "miduo_blue_jab",
    "miduo_blue_cross_punch",
    "miduo_blue_high_kick",
    "miduo_blue_roundhouse_kick",
    "miduo_blue_flying_kick",
    "miduo_blue_sweep",
    "miduo_blue_hurt",
    "miduo_blue_dead"
  ],
  "foot_collision": {
    "center": {
      "x": 0,
      "y": -4
    },
    "radius": {
      "x": 18,
      "y": 8
    }
  },
  "hp": 100,
  "hurtboxes": {
    "hurt_head": {
      "h": 18,
      "w": 24,
      "x": -12,
      "y": -64
    },
    "hurt_lower_body": {
      "h": 22,
      "w": 28,
      "x": -14,
      "y": -22
    },
    "hurt_upper_body": {
      "h": 24,
      "w": 32,
      "x": -16,
      "y": -46
    }
  },
  "run_speed": 150.0,
  "schema_version": "0.3",
  "sprite_set_ref": "miduo_blue",
  "template_id": "miduo_blue",
  "walk_speed": 95.0
}
