{
	"equipped_moves": [
		"idle",
		"walk",
		"run",
		"basic_punch",
		"hurt"
	],
	"foot_collision": {
		"center": {
			"x": 0,
			"y": -4
		},
		"radius": {
			"x": 18,
			"y": 8
		}
	},
	"hp": 100,
	"hurtboxes": {
		"hurt_head": {
			"h": 18,
			"w": 24,
			"x": -12,
			"y": -64
		},
		"hurt_lower_body": {
			"h": 22,
			"w": 28,
			"x": -14,
			"y": -22
		},
		"hurt_upper_body": {
			"h": 24,
			"w": 32,
			"x": -16,
			"y": -46
		}
	},
	"schema_version": "0.3",
	"sprite_set_ref": "skeleton_default_unarmed_s64",
	"template_id": "skeleton_default_unarmed_s64"
}
